{"dimensions":{"capability_count":2,"critical_path_duration_ticks":20,"critical_path_nodes":10,"critical_path_ratio_ppm":333333,"dag_depth":10,"dag_width":5,"density_denominator":1225,"density_numerator":225,"density_ppm":183673,"edge_count":225,"event_count":50,"evidence_count":50,"fan_in_histogram":{"0":5,"5":45},"fan_out_histogram":{"0":5,"5":45},"max_fan_in":5,"max_fan_out":5,"max_worker_cost_units_per_second":192,"max_worker_duration_scale_ppm":500110,"min_worker_cost_units_per_second":81,"min_worker_duration_scale_ppm":500017,"node_count":50,"resource_contention_denominator":100,"resource_contention_numerator":10,"resource_contention_ppm":100000,"semantic_claim_overlap_ppm":100000,"semantic_overlap_denominator":100,"semantic_overlap_numerator":10,"total_duration_ticks":60,"worker_count":4},"distribution_id":"rep-small","edges":[{"from":"task-00-00","to":"task-01-00"},{"from":"task-00-00","to":"task-01-01"},{"from":"task-00-00","to":"task-01-02"},{"from":"task-00-00","to":"task-01-03"},{"from":"task-00-00","to":"task-01-04"},{"from":"task-00-01","to":"task-01-00"},{"from":"task-00-01","to":"task-01-01"},{"from":"task-00-01","to":"task-01-02"},{"from":"task-00-01","to":"task-01-03"},{"from":"task-00-01","to":"task-01-04"},{"from":"task-00-02","to":"task-01-00"},{"from":"task-00-02","to":"task-01-01"},{"from":"task-00-02","to":"task-01-02"},{"from":"task-00-02","to":"task-01-03"},{"from":"task-00-02","to":"task-01-04"},{"from":"task-00-03","to":"task-01-00"},{"from":"task-00-03","to":"task-01-01"},{"from":"task-00-03","to":"task-01-02"},{"from":"task-00-03","to":"task-01-03"},{"from":"task-00-03","to":"task-01-04"},{"from":"task-00-04","to":"task-01-00"},{"from":"task-00-04","to":"task-01-01"},{"from":"task-00-04","to":"task-01-02"},{"from":"task-00-04","to":"task-01-03"},{"from":"task-00-04","to":"task-01-04"},{"from":"task-01-00","to":"task-02-00"},{"from":"task-01-00","to":"task-02-01"},{"from":"task-01-00","to":"task-02-02"},{"from":"task-01-00","to":"task-02-03"},{"from":"task-01-00","to":"task-02-04"},{"from":"task-01-01","to":"task-02-00"},{"from":"task-01-01","to":"task-02-01"},{"from":"task-01-01","to":"task-02-02"},{"from":"task-01-01","to":"task-02-03"},{"from":"task-01-01","to":"task-02-04"},{"from":"task-01-02","to":"task-02-00"},{"from":"task-01-02","to":"task-02-01"},{"from":"task-01-02","to":"task-02-02"},{"from":"task-01-02","to":"task-02-03"},{"from":"task-01-02","to":"task-02-04"},{"from":"task-01-03","to":"task-02-00"},{"from":"task-01-03","to":"task-02-01"},{"from":"task-01-03","to":"task-02-02"},{"from":"task-01-03","to":"task-02-03"},{"from":"task-01-03","to":"task-02-04"},{"from":"task-01-04","to":"task-02-00"},{"from":"task-01-04","to":"task-02-01"},{"from":"task-01-04","to":"task-02-02"},{"from":"task-01-04","to":"task-02-03"},{"from":"task-01-04","to":"task-02-04"},{"from":"task-02-00","to":"task-03-00"},{"from":"task-02-00","to":"task-03-01"},{"from":"task-02-00","to":"task-03-02"},{"from":"task-02-00","to":"task-03-03"},{"from":"task-02-00","to":"task-03-04"},{"from":"task-02-01","to":"task-03-00"},{"from":"task-02-01","to":"task-03-01"},{"from":"task-02-01","to":"task-03-02"},{"from":"task-02-01","to":"task-03-03"},{"from":"task-02-01","to":"task-03-04"},{"from":"task-02-02","to":"task-03-00"},{"from":"task-02-02","to":"task-03-01"},{"from":"task-02-02","to":"task-03-02"},{"from":"task-02-02","to":"task-03-03"},{"from":"task-02-02","to":"task-03-04"},{"from":"task-02-03","to":"task-03-00"},{"from":"task-02-03","to":"task-03-01"},{"from":"task-02-03","to":"task-03-02"},{"from":"task-02-03","to":"task-03-03"},{"from":"task-02-03","to":"task-03-04"},{"from":"task-02-04","to":"task-03-00"},{"from":"task-02-04","to":"task-03-01"},{"from":"task-02-04","to":"task-03-02"},{"from":"task-02-04","to":"task-03-03"},{"from":"task-02-04","to":"task-03-04"},{"from":"task-03-00","to":"task-04-00"},{"from":"task-03-00","to":"task-04-01"},{"from":"task-03-00","to":"task-04-02"},{"from":"task-03-00","to":"task-04-03"},{"from":"task-03-00","to":"task-04-04"},{"from":"task-03-01","to":"task-04-00"},{"from":"task-03-01","to":"task-04-01"},{"from":"task-03-01","to":"task-04-02"},{"from":"task-03-01","to":"task-04-03"},{"from":"task-03-01","to":"task-04-04"},{"from":"task-03-02","to":"task-04-00"},{"from":"task-03-02","to":"task-04-01"},{"from":"task-03-02","to":"task-04-02"},{"from":"task-03-02","to":"task-04-03"},{"from":"task-03-02","to":"task-04-04"},{"from":"task-03-03","to":"task-04-00"},{"from":"task-03-03","to":"task-04-01"},{"from":"task-03-03","to":"task-04-02"},{"from":"task-03-03","to":"task-04-03"},{"from":"task-03-03","to":"task-04-04"},{"from":"task-03-04","to":"task-04-00"},{"from":"task-03-04","to":"task-04-01"},{"from":"task-03-04","to":"task-04-02"},{"from":"task-03-04","to":"task-04-03"},{"from":"task-03-04","to":"task-04-04"},{"from":"task-04-00","to":"task-05-00"},{"from":"task-04-00","to":"task-05-01"},{"from":"task-04-00","to":"task-05-02"},{"from":"task-04-00","to":"task-05-03"},{"from":"task-04-00","to":"task-05-04"},{"from":"task-04-01","to":"task-05-00"},{"from":"task-04-01","to":"task-05-01"},{"from":"task-04-01","to":"task-05-02"},{"from":"task-04-01","to":"task-05-03"},{"from":"task-04-01","to":"task-05-04"},{"from":"task-04-02","to":"task-05-00"},{"from":"task-04-02","to":"task-05-01"},{"from":"task-04-02","to":"task-05-02"},{"from":"task-04-02","to":"task-05-03"},{"from":"task-04-02","to":"task-05-04"},{"from":"task-04-03","to":"task-05-00"},{"from":"task-04-03","to":"task-05-01"},{"from":"task-04-03","to":"task-05-02"},{"from":"task-04-03","to":"task-05-03"},{"from":"task-04-03","to":"task-05-04"},{"from":"task-04-04","to":"task-05-00"},{"from":"task-04-04","to":"task-05-01"},{"from":"task-04-04","to":"task-05-02"},{"from":"task-04-04","to":"task-05-03"},{"from":"task-04-04","to":"task-05-04"},{"from":"task-05-00","to":"task-06-00"},{"from":"task-05-00","to":"task-06-01"},{"from":"task-05-00","to":"task-06-02"},{"from":"task-05-00","to":"task-06-03"},{"from":"task-05-00","to":"task-06-04"},{"from":"task-05-01","to":"task-06-00"},{"from":"task-05-01","to":"task-06-01"},{"from":"task-05-01","to":"task-06-02"},{"from":"task-05-01","to":"task-06-03"},{"from":"task-05-01","to":"task-06-04"},{"from":"task-05-02","to":"task-06-00"},{"from":"task-05-02","to":"task-06-01"},{"from":"task-05-02","to":"task-06-02"},{"from":"task-05-02","to":"task-06-03"},{"from":"task-05-02","to":"task-06-04"},{"from":"task-05-03","to":"task-06-00"},{"from":"task-05-03","to":"task-06-01"},{"from":"task-05-03","to":"task-06-02"},{"from":"task-05-03","to":"task-06-03"},{"from":"task-05-03","to":"task-06-04"},{"from":"task-05-04","to":"task-06-00"},{"from":"task-05-04","to":"task-06-01"},{"from":"task-05-04","to":"task-06-02"},{"from":"task-05-04","to":"task-06-03"},{"from":"task-05-04","to":"task-06-04"},{"from":"task-06-00","to":"task-07-00"},{"from":"task-06-00","to":"task-07-01"},{"from":"task-06-00","to":"task-07-02"},{"from":"task-06-00","to":"task-07-03"},{"from":"task-06-00","to":"task-07-04"},{"from":"task-06-01","to":"task-07-00"},{"from":"task-06-01","to":"task-07-01"},{"from":"task-06-01","to":"task-07-02"},{"from":"task-06-01","to":"task-07-03"},{"from":"task-06-01","to":"task-07-04"},{"from":"task-06-02","to":"task-07-00"},{"from":"task-06-02","to":"task-07-01"},{"from":"task-06-02","to":"task-07-02"},{"from":"task-06-02","to":"task-07-03"},{"from":"task-06-02","to":"task-07-04"},{"from":"task-06-03","to":"task-07-00"},{"from":"task-06-03","to":"task-07-01"},{"from":"task-06-03","to":"task-07-02"},{"from":"task-06-03","to":"task-07-03"},{"from":"task-06-03","to":"task-07-04"},{"from":"task-06-04","to":"task-07-00"},{"from":"task-06-04","to":"task-07-01"},{"from":"task-06-04","to":"task-07-02"},{"from":"task-06-04","to":"task-07-03"},{"from":"task-06-04","to":"task-07-04"},{"from":"task-07-00","to":"task-08-00"},{"from":"task-07-00","to":"task-08-01"},{"from":"task-07-00","to":"task-08-02"},{"from":"task-07-00","to":"task-08-03"},{"from":"task-07-00","to":"task-08-04"},{"from":"task-07-01","to":"task-08-00"},{"from":"task-07-01","to":"task-08-01"},{"from":"task-07-01","to":"task-08-02"},{"from":"task-07-01","to":"task-08-03"},{"from":"task-07-01","to":"task-08-04"},{"from":"task-07-02","to":"task-08-00"},{"from":"task-07-02","to":"task-08-01"},{"from":"task-07-02","to":"task-08-02"},{"from":"task-07-02","to":"task-08-03"},{"from":"task-07-02","to":"task-08-04"},{"from":"task-07-03","to":"task-08-00"},{"from":"task-07-03","to":"task-08-01"},{"from":"task-07-03","to":"task-08-02"},{"from":"task-07-03","to":"task-08-03"},{"from":"task-07-03","to":"task-08-04"},{"from":"task-07-04","to":"task-08-00"},{"from":"task-07-04","to":"task-08-01"},{"from":"task-07-04","to":"task-08-02"},{"from":"task-07-04","to":"task-08-03"},{"from":"task-07-04","to":"task-08-04"},{"from":"task-08-00","to":"task-09-00"},{"from":"task-08-00","to":"task-09-01"},{"from":"task-08-00","to":"task-09-02"},{"from":"task-08-00","to":"task-09-03"},{"from":"task-08-00","to":"task-09-04"},{"from":"task-08-01","to":"task-09-00"},{"from":"task-08-01","to":"task-09-01"},{"from":"task-08-01","to":"task-09-02"},{"from":"task-08-01","to":"task-09-03"},{"from":"task-08-01","to":"task-09-04"},{"from":"task-08-02","to":"task-09-00"},{"from":"task-08-02","to":"task-09-01"},{"from":"task-08-02","to":"task-09-02"},{"from":"task-08-02","to":"task-09-03"},{"from":"task-08-02","to":"task-09-04"},{"from":"task-08-03","to":"task-09-00"},{"from":"task-08-03","to":"task-09-01"},{"from":"task-08-03","to":"task-09-02"},{"from":"task-08-03","to":"task-09-03"},{"from":"task-08-03","to":"task-09-04"},{"from":"task-08-04","to":"task-09-00"},{"from":"task-08-04","to":"task-09-01"},{"from":"task-08-04","to":"task-09-02"},{"from":"task-08-04","to":"task-09-03"},{"from":"task-08-04","to":"task-09-04"}],"events":[{"id":"event-00000000","kind":"node-observed","node_id":"task-00-00","sequence":0},{"id":"event-00000001","kind":"node-observed","node_id":"tas